{
  "schema_version": "1.0",
  "source_path": "/mnt/d/hustagent/work/wsl_simple_loop_normalized_v2.py",
  "parallelizable": true,
  "backend": "ray",
  "strategy": "map_reduce",
  "workers": 2,
  "chunks": 2,
  "correctness_gate": true,
  "fallback": "serial",
  "reasons": [
    "DeepSeek recommended a map-reduce process plan.",
    "Bind the generated candidate to the ray backend."
  ]
}